{
	"$schema" : "http://json-schema.org/draft-04/schema#",
	"title" : "Config file schema",
	"type" : "object",
	"properties" : {
		"LogDirectory" : {"type" : "string", "minLength" : 1},
		"Globals" : {
		    "type" : "object", 
		    "patternProperties" : {
		    	"^[a-zA-Z0-9_]+$" : {"type" : "string", "minLength" : 1}
		    },
		    "additionalProperties": false
	    },
	    "Dialplans" : {
	    	"type" : "array", 
	    	"items" : {"type" : "string", "minLength" : 1}
	    },
	    "Connections" : {
	    	"type" : "array",
	    	"items" : {
	    		"type" : "object",
	    		"properties" : {
	    			"id" : {"type" : "integer", "minimum" : 0, "exclusiveMinimum" : false},
	    			"name" : {"type" : "string", "minLength" : 1},
	    			"from_sock" : {"type" : "integer", "minimum" : 0, "exclusiveMinimum" : false},
	    			"to_sock" : {"type" : "integer", "minimum" : 0, "exclusiveMinimum" : false}
	    		},
	    		"required" : ["id", "name", "from_sock", "to_sock"]
	    	}
	    },
	    "sock" : {
	    	"type" : "array",
	    	"items" : {
	    		"type": "object", 
	    		"properties" : {
	    			"id" : {"type" : "integer", "minimum" : 0, "exclusiveMinimum" : false},
	    			"name" : {"type" : "string", "minLength" : 1},
	    			"ipaddr" : {"type" : "string", "pattern" : "^(([1-9]|[1-9][0-9]|1[0-9]{2}|2[0-4][0-9]|25[0-5])\\.){1}(([0-9]|[1-9][0-9]|1[0-9]{2}|2[0-4][0-9]|25[0-5])\\.){2}([0-9]|[1-9][0-9]|1[0-9]{2}|2[0-4][0-9]|25[0-5])$"},
	    			"port" : {"type" : "integer", "minimum" : 1000, "maximum" : 65536, "exclusiveMinimum" : false, "exclusiveMaximum" : false},
	    			"transport" : {"type" : "string", "minLength" : 3},
	    			"proto" : {"type" : "string", "minLength" : 3},
	    			"profile": {"type" : "integer", "minimum" : 0, "exclusiveMinimum" : false},
	    			"network_buffer" : {"type" : "integer", "minimum" : 1000, "exclusiveMinimum" : false}
	    		},
	    		"required" : ["id", "ipaddr", "port", "transport", "proto", "profile"]
	    	}
	    },
	    "users" : {
	    	"type": "array", 
	    	"items": {
	    		"type": "object", 
	    		"properties": {
	    			"id": {"type" : "integer", "minimum" : 0, "exclusiveMinimum" : false},
	    			"username": {"type": "string", "minLength": 1, "maxLength": 255}, 
	    			"authname": {"type": "string", "minLength": 1, "maxLength": 255}, 
	    			"password": {"type": "string", "minLength": 1, "maxLength": 63}, 
	    			"domain": {"type": "string", "minLength": 1, "maxLength": 255},
	    			"service": {
	    				"type" : "array",
	    				"items" : {"type" : "string", "minLength" : 1},
	    			"servicelist": {
	    				"type" : "array",
	    				"items" : {"type" : "string", "minLength" : 1}	    			
	    			}
	    		},
	    		"required" : ["id", "username"]
	    	}
	    },
	    "trunks" : {
	    	"type": "array", 
	    	"items": {
	    		"type": "object", 
	    		"properties": {
	    			"id": {"type" : "integer", "minimum" : 0, "exclusiveMinimum" : false},
	    			"number": {"type" : "integer", "minimum" : 0, "exclusiveMinimum" : false},
	    			"name": {"type": "string", "minLength": 1, "maxLength": 255}, 
	    			"authname": {"type": "string", "minLength": 1, "maxLength": 255}, 
	    			"password": {"type": "string", "minLength": 1, "maxLength": 63}, 
	    			"domain": {"type": "string", "minLength": 1, "maxLength": 255}
	    			}
	    		},
	    		"required" : ["id", "name"]
	    	}
	    },
	    "device": {
	    	"type": "array", 
	    	"items": {
	    		"type": "object", 
	    		"properties": {
	    			"id": {"type" : "integer", "minimum" : 0, "exclusiveMinimum" : false},
	    			"type": {"type": "string", "minLength": 1, "maxLength": 15}, 
	    			"sw": {"type": "string", "minLength": 1, "maxLength": 15}, 
	    			"proto": {"type": "string", "minLength": 1, "maxLength": 15}, 
	    			"ipaddr": {"type": "string", "minLength": 7, "maxLength": 15}, 
	    			"port": {"type": "integer", "minimum": 1, "maximum": 65535}, 
	    			"login": {"type": "string", "minLength": 1, "maxLength": 255}, 
	    			"password": {"type": "string", "minLength": 1, "maxLength": 63}
	    		},
	    		"required" : ["id", "ipaddr", "port", "login"]
	    	}
	    },
	    "sigtran": {
	    	"type": "array", 
	    	"items": {
	    		"type": "object", 
	    		"properties": {
	    			"id": {"type" : "integer", "minimum" : 0, "exclusiveMinimum" : false},
	    			"asp": {
	    				"type" : "array",
	    				"items" : {"type" : "string", "minLength" : 1}
	    			},
	    			"iid": {
	    				"type" : "array",
	    				"items" : {"type" : "string", "minLength" : 1}
	    			}
	    		},
	    		"required" : ["id"]
	    	}
	    },
	    "sorm" : {
	    	"type" : "array",
	    	"items" : {
	    		"type" : "object",
	    		"properties" : {
	    			"id" : {"type" : "integer", "minimum" : 0, "exclusiveMinimum" : false},
	    			"ormNum" : {"type": "integer", "minimum": 0, "maximum": 255},
	    			"password" : {"type": "integer", "minimum": 0, "maximum": 999999},
	    			"version": {"type": "string", "minLength": 1, "maxLength": 255}, 
	    			"station_type": {"type": "string", "minLength": 1, "maxLength": 255}
	    		},
	    		"required" : ["id", "ormNum", "password", "version", "station_type"]
	    	}
	    },
	    "mgcp" : {
	    	"type" : "array",
	    	"items" : {
	    		"type" : "object",
	    		"properties" : {
	    			"id" : {"type" : "integer", "minimum" : 0, "exclusiveMinimum" : false},
	    			"mid" : {"type" : "string", "minLength" : 1},
	    			"encoding" : {"type" : "string", "enum" : ["full_text", "compact_text"]},
	    			"terms" : {
	    				"type" : "array",
	    				"items" : {"type" : "string", "minLength" : 1}
	    			}
	    		},
	    		"required" : ["id", "mid"]
	    	}
	    },
	    "megaco" : {
	    	"type" : "array",
	    	"items" : {
	    		"type" : "object",
	    		"properties" : {
	    			"id" : {"type" : "integer", "minimum" : 0, "exclusiveMinimum" : false},
	    			"mid" : {"type" : "string", "minLength" : 1},
	    			"encoding" : {"type" : "string", "enum" : ["full_text", "compact_text"]},
	    			"terms" : {
	    				"type" : "array",
	    				"items" : {"type" : "string", "minLength" : 1}
	    			}
	    		},
	    		"required" : ["id", "mid"]
	    	}
	    }
    },
	"required" : ["LogDirectory"]
}